{
  "schema_version": 1,
  "selection_id": "selection_2026_09_17_example",
  "source_id": "authorized_example_source",
  "rubric_id": "clippers-rubric-v1",
  "rubric_version": 1,
  "rankings": [
    {
      "rank": 1,
      "candidate_id": "candidate_example_001",
      "candidate_artifact": "candidate.json",
      "status": "eligible",
      "scores": {
        "hook_first_two_seconds": 1.6,
        "narrative_payoff": 1.7,
        "attention_intensity": 1.3,
        "visual_audio_support": 1.5,
        "platform_fit": 1.4,
        "accessibility": 1.8
      },
      "weighted_score": 1.548,
      "notes": "Hypothesis: clear rule and complete payoff may outperform the source baseline."
    }
  ]
}
